{
  "schema_version": "1.0",
  "kind": "bo-atlas-diagram",
  "exported_at": "2026-10-12T09:00:00.000Z",
  "process": { "title": "Onboarding av ny ansatt", "category_id": "cat-hr-onboarding" },
  "lanes": [
    { "id": "lane-hr", "label": "HR", "height": 120 },
    { "id": "lane-leder", "label": "Nærmeste leder", "height": 194 },
    { "id": "lane-it", "label": "IT", "height": 120 }
  ],
  "phases": [
    { "title": "Før oppstart", "x": 0, "width": 280 },
    { "title": "Første dag", "x": 280, "width": 280 },
    { "title": "Første måned", "x": 560, "width": 280 }
  ],
  "steps": [
    { "id": "4f1c6a2e-8d3b-4e6f-9a1c-2b7d5e8f0a11", "title": "Kontrakt signert", "phase": "Før oppstart", "lane": "lane-hr", "shape": "oval", "position": { "x": 75, "y": 48 } },
    { "id": "7a2d9b4c-1e5f-4a8b-b3c6-9d0e1f2a3b22", "title": "Bestill utstyr og tilganger", "description": "PC, telefon, M365-lisens og tilganger etter rolle.", "phase": "Før oppstart", "lane": "lane-leder", "shape": "rect", "position": { "x": 70, "y": 168 } },
    { "id": "unlinked:Før oppstart|Opprett bruker", "title": "Opprett bruker", "phase": "Før oppstart", "lane": "lane-it", "shape": "rect", "position": { "x": 70, "y": 362 } },
    { "id": "b5e8c1d2-3f4a-4b6c-8d9e-0a1b2c3d4e33", "title": "Velkomstmøte", "description": "Leder tar imot, presenterer teamet og dagens plan.", "phase": "Første dag", "lane": "lane-leder", "shape": "manual", "position": { "x": 342, "y": 168 } },
    { "id": "c6f9d2e3-4a5b-4c7d-9e0f-1b2c3d4e5f44", "title": "Sikkerhetsopplæring gjennomført", "phase": "Første dag", "lane": "lane-hr", "shape": "rect", "position": { "x": 350, "y": 48 } },
    { "id": "d7a0e3f4-5b6c-4d8e-af10-2c3d4e5f6a55", "title": "Opplæringsplan", "description": "Skriftlig plan for de første 30 dagene.", "phase": "Første dag", "lane": "lane-leder", "shape": "document", "position": { "x": 350, "y": 242 } },
    { "id": "e8b1f4a5-6c7d-4e9f-b021-3d4e5f6a7b66", "title": "Prøvetidssamtale", "phase": "Første måned", "lane": "lane-leder", "shape": "rect", "position": { "x": 630, "y": 168 } },
    { "id": "f9c2a5b6-7d8e-4fa0-8132-4e5f6a7b8c77", "title": "Onboarding fullført", "phase": "Første måned", "lane": "lane-hr", "shape": "oval", "position": { "x": 635, "y": 48 } }
  ],
  "connectors": [
    { "from": "4f1c6a2e-8d3b-4e6f-9a1c-2b7d5e8f0a11", "to": "7a2d9b4c-1e5f-4a8b-b3c6-9d0e1f2a3b22", "style": "solid", "arrow": "end" },
    { "from": "7a2d9b4c-1e5f-4a8b-b3c6-9d0e1f2a3b22", "to": "unlinked:Før oppstart|Opprett bruker", "label": "bestilling", "style": "dashed", "arrow": "end" },
    { "from": "7a2d9b4c-1e5f-4a8b-b3c6-9d0e1f2a3b22", "to": "b5e8c1d2-3f4a-4b6c-8d9e-0a1b2c3d4e33", "style": "solid", "arrow": "end" },
    { "from": "b5e8c1d2-3f4a-4b6c-8d9e-0a1b2c3d4e33", "to": "c6f9d2e3-4a5b-4c7d-9e0f-1b2c3d4e5f44", "style": "solid", "arrow": "end" },
    { "from": "b5e8c1d2-3f4a-4b6c-8d9e-0a1b2c3d4e33", "to": "d7a0e3f4-5b6c-4d8e-af10-2c3d4e5f6a55", "style": "solid", "arrow": "end" },
    { "from": "d7a0e3f4-5b6c-4d8e-af10-2c3d4e5f6a55", "to": "e8b1f4a5-6c7d-4e9f-b021-3d4e5f6a7b66", "style": "solid", "arrow": "end" },
    { "from": "e8b1f4a5-6c7d-4e9f-b021-3d4e5f6a7b66", "to": "f9c2a5b6-7d8e-4fa0-8132-4e5f6a7b8c77", "style": "solid", "arrow": "end" }
  ],
  "annotations": [
    { "id": "a1b2c3d4-e5f6-4a7b-8c9d-0e1f2a3b4c88", "kind": "note", "text": "Tilganger bestilles senest fem virkedager før oppstart.", "lane": "lane-leder", "attached_to": "7a2d9b4c-1e5f-4a8b-b3c6-9d0e1f2a3b22", "position": { "x": 230, "y": 168 } }
  ]
}
